nID;sName;nOrder;nID_Subcategory;sInfo;sFAQ;sLaw;nOpenedLimit;sSubjectOperatorName
1;Довідка про відсутність або наявніcть судимості;1;3;[*];;;0;Міністерство внутрішніх справ
2;Картка обліку об’єкта торговельного призначення, сфери послуг та з виробництва продуктів харчування;100;7;;;;0;Місцеві органи влади
3;_test_ved;100;23;;;;0;Тестова служба
4;Видача копій, витягів з розпоряджень міського (селищного, районного) голови, рішень, прийнятих міською (селищною, районною) радою та виконавчим комітетом;3;2;[*];;;0;Місцеві органи влади
5;Дозвіл на використання місцевої символіки;100;11;[*];;;0;Місцеві органи влади
6;Надання обмежень на використання садибної земельної ділянки;100;1;;;;0;Місцеві органи влади
7;Дозвіл на рекламний носій ;100;7;;;;0;Місцеві органи влади
8;Посвідчення «Ветеран праці»;100;22;[*];;[*];0;Управління праці та соціального захисту населення
9;Довідка про перебування на обліку бажаючих отримати земельну ділянку під індивідуальне будівництво;100;1;;;;0;Місцеві органи влади
10;Витяг з технічної документації про нормативну грошову оцінку земельної ділянки;100;1;;;;0;Державна служба з питань геодезії, картографії та кадастру
11;Звернення до голови РДА;5;2;[*];;;0;Місцеві органи влади
12;Присвоєння поштових адрес об'єктам нерухомості (нежитлові приміщення);100;7;;;;0;Місцеві органи влади
13;Організація ринку, ярмарку;100;19;[*];;;0;Місцеві органи влади
14;_Перевірка дійсності свідоцтва про народження;100;2;;;;0;Міністерство юстиції
15;Дозвіл на розміщення зовнішньої реклами;100;7;[*];;;0;Місцеві органи влади
16;Дозвіл на МАФ;100;7;;;;0;Місцеві органи влади
17;Взяття на облік громадян, які потребують поліпшення житлових умов;100;1;[*];;;0;Місцеві органи влади
18;Взяття на соціальний квартирний облік;100;1;;;;0;Місцеві органи влади
19;Дозвіл на переоформлення договору найму жилого приміщення;100;1;[*];;;0;Місцеві органи влади
20;Реєстрація громадського об’єднання;100;6;[*];;;0;Міністерство юстиції
21;Інформація про субсидію на оплату ЖКП;100;22;[*];;;0;Управління праці та соціального захисту населення
22;Маю питання щодо послуги;100;23;;;;0;Тестова служба
23;Довідка незайнятому населенню про відсутність земельних ділянок для ведення ОСГ;100;1;[*];;;0;Місцеві органи влади - Виконавчий комітет
24;Довідка про реєстрацію місця проживання/перебування особи (для отримання ID-картки);100;4;[*];;;0;Місцеві органи влади
25;Видача ID-картки замість вклеювання до паспорта громадянина фотокартки при досягненні 25- і 45-річного віку;4;4;[*];;;0;Державна міграційна служба
26;Зняття з реєстрації місця проживання особи;4;4;[*];;;0;Органи місцевого самоврядування
27;Дозвіл на розроблення проекту землеустрою щодо відведення земельної ділянки;100;1;[*];;;0;Місцеві органи влади
28;Оформлення та видача паспорта громадянина України (ID-картки) по досягненні 14-річного віку;1;4;[*];;;0;Державна міграційна служба
29;Реєстрація місця проживання особи (із опцією одночасного зняття з реєстрації з попереднього місця);3;4;[*];;;0;Органи місцевого самоврядування
30;Посвідчення члена сім’ї загиблого (померлого) ветерана війни;100;22;[*];;[*];0;Управління праці та соціального захисту населення
31;Надання статусу та видача довідок «Дитина війни»;100;22;[*];;[*];0;Управління праці та соціального захисту населення
32;Державна реєстрація права власності на нерухоме майно та його обтяжень;100;1;;;;0;Міністерство юстиції
33;Довідка про величини фонових концентрацій забруднювальних речовин в атмосферному повітрі;100;9;[*];;;0;Обласна державна адміністрація - департамент екології
34;Заявка на проведення огляду судна в експлуатацiї;100;17;[*];;;0;Регістр судноплавства України
35;Дозвіл на виготовлення будівельного паспорта на житловий або садовий будинок;100;1;[*];;;0;Місцеві органи влади
36;Посвідчення учасника війни;100;22;[*];;;0;Управління праці та соціального захисту населення
37;Паспорт прив’язки тимчасових споруд для здійснення підприємницької діяльності;100;7;;;;0;Місцеві органи влади
38;Технічний висновок про вплив переобладнання на несучу спроможність конструкцій;100;1;;;;0;Місцеві органи влади
39;Повідомлення про зміну даних у зареєстрованій Декларації про початок виконання підготовчих/будівельних робіт;100;1;;;;0;Державна архітектурно-будівельна інспекція України
40;Повідомлення про проведення зборів, мітингів, маніфестацій і демонстрацій, спортивних, видовищних та інших масових заходів;100;2;[*];;[*];0;Місцеві органи влади
41;Виправлення технічної помилки у відомостях з державного земельного кадастру, яка була допущена органом, що здійснює його ведення;100;1;[*];;;0;Державне земельне агентство
42;Внесення до Державного земельного кадастру відомостей (змін до них) про землі в межах території адміністративно-територіальних одиниць;100;1;;;;0;Державне земельне агентство
43;Внесення до Державного земельного кадастру відомостей про обмеження у використанні земель, встановлені законами та прийнятими відповідно до них нормативно-правовими актами;100;1;;;;0;Державне земельне агентство
44;Державна реєстрація обмежень у використанні земель;100;1;;;;0;Державне земельне агентство
45;Викопіювання з кадастрової карти та іншої картографічної документації ДЗК;100;1;[*];;;0;Державне земельне агентство
46;Витяг з ДЗК про землі в межах території адміністративно-територіальних одиниць;100;1;[*];;;0;Державне земельне агентство
47;Витяг з ДЗК про обмеження у використанні земель;100;1;[*];;;0;Державне земельне агентство
48;Довідка, що містить узагальнену інформацію про землі (території);100;1;[*];;;0;Державне земельне агентство
49;Лист про прийняття рішення щодо видачі дозволу на викиди забруднюючих речовин в атмосферне повітря стаціонарними джерелами суб`єкта господарювання (2 або 3 група);100;9;[*];;[*];0;Головне управління Держпродспоживслужби
50;Направлення в дошкільні навчальні заклади (групи) компенсуючого типу;100;20;;;;0;Місцеві органи влади
51;Внесення змін до декларації про готовність об`єкта до експлуатації;100;1;;;;0;Державна архітектурно-будівельна інспекція України
52;Внесення змін до декларації про початок виконання будівельних робіт;100;1;;;;0;Державна архітектурно-будівельна інспекція України
53;Внесення змін до декларації про початок виконання підготовчих робіт;100;1;;;;0;Державна архітектурно-будівельна інспекція України
54;Декларація про готовність до експлуатації об`єкта I-ІІ категорії;100;1;;;;0;Державна архітектурно-будівельна інспекція України
55;Реєстрація декларації про початок будівельних робіт;100;1;;;;0;Державна архітектурно-будівельна інспекція України
56;Декларація про готовність до експлуатації об’єкта I-ІІ категорії, будівництво якого здійснено на підставі будівельного паспорта;100;1;;;;0;Державна архітектурно-будівельна інспекція України
57;_test_send_user;100;23;;;;0;Тестова служба
58;Документи про уповноваження з розслідування нещасного випадку;100;2;[*];;;0;Місцеві органи влади
59;Ліцензія на здійснення суб’єктами зовнішньоекономічної діяльності експорту товарів;100;10;[*];;;0;Обласна державна адміністрація - департамент економічного розвитку
60;Ліцензія на здійснення суб’єктами зовнішньоекономічної діяльності імпорту товарів;100;10;[*];;;0;Обласна державна адміністрація - департамент економічного розвитку
61;Дозвіл на проїзд під заборонні знаки дорожнього регулювання;100;17;;;;0;Місцеві органи влади
62;_Страхування цивільної відповідальності власника зброї;100;23;;;;0;Тестова служба
63;Дозвіл на видалення зелених насаджень;100;7;[*];;;0;Місцеві органи влади
64;Ордер на службове жиле приміщення;100;1;[*];;;0;Місцеві органи влади
65;Дозвіл на внесення суб’єкта кінематографії до державного реєстру виробників, розповсюджувачів і демонстраторів фільмів;100;11;[*];;;0;Обласна державна адміністрація - управління культури
66;Дозвіл на проведення робіт на пам'ятках історії, монументального мистецтва та науки і техніки місцевого значення;100;11;[*];;;0;Обласна державна адміністрація - управління культури
67;Погодження розміщення реклами на пам’ятках місцевого значення, в межах зон охорони таких пам’яток в населених пунктах;100;11;[*];;;0;Обласна державна адміністрація - управління культури
68;Реєстрація дозволів на проведення археологічних розвідок, розкопок;100;11;[*];;;0;Обласна державна адміністрація - управління культури
69;Свідоцтво про атестацію початкових спеціалізованих мистецьких навчальних закладів;100;11;;;;0;Обласна державна адміністрація - управління культури
70;Ліцензія на здійснення освітньої діяльності у сфері дошкільної освіти;100;13;;;;0;Обласна державна адміністрація - департамент освіти і науки
71;Ліцензія на здійснення освітньої діяльності у сфері загальної середньої освіти;100;13;;;;0;Обласна державна адміністрація - департамент освіти і науки
72;Ліцензія на здійснення освітньої діяльності у сфері позашкільної освіти;100;13;;;;0;Обласна державна адміністрація - департамент освіти і науки
73;Переоформлення, видача копії або дубліката ліцензії на надання освітніх послуг у сфері загальної середньої, дошкільної, позашкільної освіти;100;13;[*];;;0;Обласна державна адміністрація - департамент освіти і науки
74;Організація об’єкта з надання ринкових послуг (ринкового об’єкта);100;7;;;;0;Місцеві органи влади
75;Дозвіл органу опіки та піклування на вчинення правочину з майном, що перебуває у власності неповнолітніх;100;20;[*];;;0;Місцеві органи влади - Служба у справах дітей
76;Отримання інформації про хід виконавчого провадження;100;24;[*];;;0;Міністерство юстиції - управління державної виконавчої служби
77;Отримання відомостей про платіжні реквізити Державної виконавчої служби;100;24;[*];;;0;Міністерство юстиції - управління державної виконавчої служби
78;Зразки документів для звернення до органів Державної виконавчої служби;100;24;[*];;;0;Міністерство юстиції - управління державної виконавчої служби
79;Дозвіл на відключення від мереж централізованого опалення і постачання гарячої води;100;1;[*];;;0;Місцеві органи влади
80;Витяг з Єдиного державного реєстру юридичних осіб та фізичних осіб – підприємців;100;15;;;;0;Міністерство юстиції
81;Довідка з ЄДР юридичних осіб та фізичних осіб-підприємців;100;15;;;;0;Міністерство юстиції
82;Включення до ЄДР відомостей про закриття відокремленого підрозділу юридичної особи;100;15;;;;0;Міністерство юстиції
83;Включення до ЄДР відомостей про створення відокремленого підрозділу юридичної особи;100;15;;;;0;Міністерство юстиції
84;Внесення до ЄДР запису про втрату оригіналів установчих документів юридичної особи;100;15;;;;0;Міністерство юстиції
85;Довідка про невідвідування дошкільного закладу дитиною;100;20;;;;0;Місцеві органи влади
86;Державна реєстрація змін до установчих документів юридичної особи;100;15;;;;0;Міністерство юстиції
87;Державна реєстрація припинення підприємницької діяльності фізичної особи – підприємця за її рішенням;100;15;[*];;;1;Міністерство юстиції
88;Державна реєстрація припинення юридичної особи в результаті злиття, приєднання, поділу або перетворення;100;15;;;;0;Міністерство юстиції
89;Державна реєстрація припинення юридичної особи в результаті її ліквідації;100;15;;;;0;Міністерство юстиції
90;Державна реєстрація фізичної особи-підприємця;100;15;;;;0;Міністерство юстиції
91;Державна реєстрація юридичної особи;100;15;;;;0;Міністерство юстиції
92;Реєстрація великотоннажних та інших технологічних транспортних засобів, що не підлягають експлуатації на вулично-дорожній мережі загального користування;100;8;;;;0;Державна служба гірничого нагляду та промислової безпеки
93;Зняття з обліку великотоннажних та інших технологічних транспортних засобів, що не підлягають експлуатації на вулично-дорожній мережі загального користування;100;8;;;;0;Державна служба гірничого нагляду та промислової безпеки
94;Перереєстрація великотоннажних та інших технологічних транспортних засобів, що не підлягають експлуатації на вулично-дорожній мережі загального користування;100;8;;;;0;Державна служба гірничого нагляду та промислової безпеки
95;Тимчасова реєстрація великотоннажних та інших технологічних транспортних засобів, що не підлягають експлуатації на вулично-дорожній мережі загального користування;100;8;;;;0;Державна служба гірничого нагляду та промислової безпеки
96;Дозвіл релігійним організаціям на проведення релігійних заходів, які проводяться поза межами культових споруд;100;11;[*];;;0;Місцеві органи влади
97;Довідка про неотримання аліментів або розмір аліментів (для отримання тимчасової державної допомоги);100;24;[*];;;0;Міністерство юстиції - управління державної виконавчої служби
98;Видача відомостей з документації із землеустрою, що включена до державного фонду документації із землеустрою;100;1;;;;0;Державне земельне агентство
99;Внесення до Державного земельного кадастру відомостей (змін до них) про земельну ділянку;100;1;[*];;;0;Державне земельне агентство
100;Державна реєстрація земельної ділянки з видачею витягу з Державного земельного кадастру;100;1;[*];;;0;Державне земельне агентство
101;Витяг з ДЗК про земельну ділянку;100;1;;;;0;Державне земельне агентство
102;Довідка з Державної статистичної звітності про наявність земель та розподіл їх за власниками земель, землекористувачами, угіддями (за даними форми 6-ЗЕМ);100;1;[*];;;0;Державне земельне агентство
103;Приватизація квартир, що знаходяться у комунальній власності;100;1;[*];;;0;Місцеві органи влади
104;Приватизація державного житлового фонду;100;1;;;;0;Місцеві органи влади
105;Приватизація житлових приміщень (кімнат, квартир) у гуртожитках що належать до комунальної власності територіальної громади міста;100;1;;;;0;Місцеві органи влади
106;Акт обстеження земельної ділянки на наявність зелених насаджень;100;1;[*];;;0;Місцеві органи влади
107;Запис на особистий прийом до керівника органу державної виконавчої служби;100;24;[*];;;0;Міністерство юстиції - управління державної виконавчої служби
108;Дозвіл на розроблення проекту землеустрою щодо відведення земельної ділянки (самочинно збудоване нерухоме майно);100;1;[*];;;0;Місцеві органи влади
109;Дозвіл на виготовлення технічної документації із землеустрою щодо посвідчення права користування земельною ділянкою;100;1;;;;0;Місцеві органи влади
110;Видача/обмін посвідчення особи моряка;10;4;;;;0;Міністерство інфраструктури України
111;Лісорубний квиток (спеціальний дозвіл) на заготівлю деревини під час проведення рубок головного користування;100;5;;;;0;Обласна державна адміністрація - управління лісового та мисливського господарства
112;Видача розрахунку заборгованості зі сплати аліментів;100;24;[*];;;0;Міністерство юстиції - управління державної виконавчої служби
113;Запит на отримання публічної інформації від фізичної особи в письмовому вигляді;100;24;[*];;[*];0;Міністерство юстиції - управління державної виконавчої служби
114;_Тестирование удаления заявки;100;23;[*];;;0;Тестова служба
