nID;sName;nOrder;nID_Subcategory;sInfo;sFAQ;sLaw;nOpenedLimit;sSubjectOperatorName
934;Видача ліцензії на постачання електричної енергії за регульованим тарифом;100;5;;;;0;Національна комісія, що здійснює державне регулювання у сфері енергетики та комунальних послуг
935;Видача ліцензії на постачання природного газу, газу (метану) вугільних родовищ за нерегульованим тарифом;100;5;;;;0;Національна комісія, що здійснює державне регулювання у сфері енергетики та комунальних послуг
936;Видача ліцензії на постачання природного газу, газу (метану) вугільних родовищ за регульованим тарифом;100;5;;;;0;Національна комісія, що здійснює державне регулювання у сфері енергетики та комунальних послуг
937;Видача ліцензії на провадження господарської діяльності з виробництва теплової енергії;100;5;;;;0;Національна комісія, що здійснює державне регулювання у сфері енергетики та комунальних послуг
938;Видача ліцензії на провадження господарської діяльності з постачання теплової енергії;100;5;;;;0;Національна комісія, що здійснює державне регулювання у сфері енергетики та комунальних послуг
939;Видача ліцензії на провадження господарської діяльності з транспортування теплової енергії магістральними та місцевими (розподільчими) тепловими мережами;100;5;;;;0;Національна комісія, що здійснює державне регулювання у сфері енергетики та комунальних послуг
940;Видача ліцензії на провадження господарської діяльності з централізованого водопостачання та водовідведення;100;5;;;;0;Національна комісія, що здійснює державне регулювання у сфері енергетики та комунальних послуг
941;Видача ліцензії на розподіл електричної енергії (передачу електричної енергії місцевими (локальними) електричними мережами);100;5;;;;0;Національна комісія, що здійснює державне регулювання у сфері енергетики та комунальних послуг
942;Видача ліцензії на розподіл природного, нафтового газу і газу (метану) вугільних родовищ;100;5;;;;0;Національна комісія, що здійснює державне регулювання у сфері енергетики та комунальних послуг
943;Видача ліцензії на транспортування нафтопродуктів магістральним трубопроводом;100;5;;;;0;Національна комісія, що здійснює державне регулювання у сфері енергетики та комунальних послуг
944;Видача ліцензії на транспортування природного, нафтового газу і газу (метану) вугільних родовищ трубопроводами;100;5;;;;0;Національна комісія, що здійснює державне регулювання у сфері енергетики та комунальних послуг
945;_можно занимать;100;23;;;;0;Тестова служба
946;_можно занимать;100;23;;;;0;Тестова служба
947;_можно занимать;100;23;;;;0;Тестова служба
948;Внесення до державного земельного кадастру відомостей (змін до них) про межі державного кордону Ураїни у разі, коли замовником документації із землеустрою, на підставі якої вносяться відомості, є орган державної влади;100;7;;;;0;Державна служба з питань геодезії, картографії та кадастру
949;Внесення змін до ліцензії у разі зміни найменування або місцезнаходження ліцензіата — юридичної особи або прізвища, імені та по батькові, місця проживання ліцензіата — фізичної особи (без зміни місця провадження діяльності);100;7;;;;0;Державна інспекція ядерного регулювання 
950;Державна реєстрація обмежень у використанні земель за зверненням органів виконавчої влади та органів місцевого самоврядування;100;7;;;;0;Державна служба з питань геодезії, картографії та кадастру
951;Дозвіл на днопоглиблювальні роботи, прокладання кабелів, трубопроводів та інших комунікацій на землях водного фонду (крім робіт на землях водного фонду в межах прибережних захисних смуг уздовж морів, морських заток і лиманів, у внутрішніх морських водах, лиманах і територіальному морі);100;7;;;;0;Державне агентство водних ресурсів 
952;Кваліфікація когенераційної установки;100;5;;;;0;Державне агентство з енергоефективності та енергозбереження 
953;Надання відомостей з Державного земельного кадастру у формі: викопіювання з кадастрової карти (плану) та іншої картографічної документації Державного земельного кадастру;100;7;;;;0;Державна служба з питань геодезії, картографії та кадастру
954;Надання відомостей з Державного земельного кадастру у формі: довідки, що містить узагальнену інформацію про землі (території);100;7;;;;0;Державна служба з питань геодезії, картографії та кадастру
955;Надання висновку на погодження проекту землеустрою (для ділянок на яких розміщені об'єкти культурної спадщини);100;11;[*];;;0;Обласна державна адміністрація - управління культури
956;Надання довідки про наявність та розмір земельної частки (паю);100;1;[*];;;0;Державна служба з питань геодезії, картографії та кадастру
957;Надання довідки про наявність у Державному земельному кадастрі відомостей про одержання у власність земельної ділянки у межах норм безоплатної приватизації за певним видом її цільового призначення (використання);100;1;[*];;;0;Державна служба з питань геодезії, картографії та кадастру
958;Підготовка та видача довідки про припинення ведення особистого селянського господарства на території міста, або про вихід з такого господарства;100;1;;;;0;Місцеві органи влади
959;_Офіційна покупка голосу народного депутата;100;23;;;;0;Тестова служба
960;_можно занимать;100;23;;;;0;Тестова служба
961;Переоформлення ліцензії на провадження господарської діяльності з постачання теплової енергії;100;5;;;;0;Національна комісія, що здійснює державне регулювання у сфері енергетики та комунальних послуг
962;Переоформлення ліцензії на виробництво електричної енергії;100;5;;;;0;Національна комісія, що здійснює державне регулювання у сфері енергетики та комунальних послуг
963;Переоформлення ліцензії на виробництво теплової енергії на теплоелектроцентралях, когенераційних установках та установках з використанням нетрадиційних або поновлюваних джерел енергії;100;5;;;;0;Національна комісія, що здійснює державне регулювання у сфері енергетики та комунальних послуг
964;Переоформлення ліцензії на зберігання природного газу, газу (метану) вугільних родовищ;100;5;;;;0;Національна комісія, що здійснює державне регулювання у сфері енергетики та комунальних послуг
965;Переоформлення ліцензії на комбіноване виробництво теплової та електричної енергії;100;5;;;;0;Національна комісія, що здійснює державне регулювання у сфері енергетики та комунальних послуг
966;Переоформлення ліцензії на оптове постачання електричної енергії;100;5;;;;0;Національна комісія, що здійснює державне регулювання у сфері енергетики та комунальних послуг
967;Переоформлення ліцензії на передачу електричної енергії магістральними та міждержавними електричними мережами;100;5;;;;0;Національна комісія, що здійснює державне регулювання у сфері енергетики та комунальних послуг
968;Переоформлення ліцензії на постачання електричної енергії за нерегульованим тарифом;100;5;;;;0;Національна комісія, що здійснює державне регулювання у сфері енергетики та комунальних послуг
969;Переоформлення ліцензії на постачання електричної енергії за регульованим тарифом;100;5;;;;0;Національна комісія, що здійснює державне регулювання у сфері енергетики та комунальних послуг
970;Переоформлення ліцензії на постачання природного газу, газу (метану) вугільних родовищ за нерегульованим тарифом;100;5;;;;0;Національна комісія, що здійснює державне регулювання у сфері енергетики та комунальних послуг
971;Переоформлення ліцензії на постачання природного газу, газу (метану) вугільних родовищ за регульованим тарифом;100;5;;;;0;Національна комісія, що здійснює державне регулювання у сфері енергетики та комунальних послуг
972;Переоформлення ліцензії на провадження господарської діяльності з виробництва теплової енергії;100;5;;;;0;Національна комісія, що здійснює державне регулювання у сфері енергетики та комунальних послуг
973;Переоформлення ліцензії на провадження господарської діяльності з транспортування теплової енергії магістральними та місцевими (розподільчими) тепловими мережами;100;5;;;;0;Національна комісія, що здійснює державне регулювання у сфері енергетики та комунальних послуг
974;Переоформлення ліцензії на розподіл електричної енергії (передачу електричної енергії місцевими (локальними) електричними мережами);100;5;;;;0;Національна комісія, що здійснює державне регулювання у сфері енергетики та комунальних послуг
975;Переоформлення ліцензії на розподіл природного, нафтового газу і газу (метану) вугільних родовищ;100;5;;;;0;Національна комісія, що здійснює державне регулювання у сфері енергетики та комунальних послуг
976;Переоформлення ліцензії на транспортування нафтопродуктів магістральним трубопроводом;100;5;;;;0;Національна комісія, що здійснює державне регулювання у сфері енергетики та комунальних послуг
977;Переоформлення ліцензії на транспортування природного, нафтового газу і газу (метану) вугільних родовищ трубопроводами;100;5;;;;0;Національна комісія, що здійснює державне регулювання у сфері енергетики та комунальних послуг
978;Підтвердження належності палива до альтернативного з видачею документа про ідентифікацію палива;100;5;;;;0;Державне агентство з енергоефективності та енергозбереження 
979;Погодження відчуження або передачі пам'яток національного значення їх власниками або уповноваженими ними органами іншим особам у володіння, користування або управління: Відчуження, продаж, дарування;100;11;;;;0;Міністерство культури
980;Погодження відчуження або передачі пам'яток національного значення їх власниками або уповноваженими ними органами іншим особам у володіння, користування або управління: Іпотека;100;11;;;;0;Міністерство культури
981;Погодження відчуження або передачі пам'яток національного значення їх власниками або уповноваженими ними органами іншим особам у володіння, користування або управління: Оренда;100;11;;;;0;Міністерство культури
982;Прийняття рішення щодо введення родовища або окремого покладу нафти і газу: в дослідно-промислову розробку;100;8;;;;0;Міністерство енергетики та вугільної промисловості 
983;Прийняття рішення щодо введення родовища або окремого покладу нафти і газу: у промислову розробку;100;8;;;;0;Міністерство енергетики та вугільної промисловості 
984;Проведення державної експертизи з енергозбереження з видачею експертного висновку проектів інструктивно-методичних та нормативно-технічних актів, будівельних норм і правил, документації на створення та придбання нової енергоємної техніки, технології і матеріалів, інших документів і матеріалів, що регламентують всі види діяльності у сфері енергозбереження;100;5;;;;0;Державне агентство з енергоефективності та енергозбереження 
985;Проведення державної експертизи з енергозбереження з видачею експертного висновку проектів схем розвитку і розміщення продуктивних сил, проектів розвитку галузей народного господарства, територіальних схем енергозабезпечення, іншої передпланової та передпроектної документації;100;5;;;;0;Державне агентство з енергоефективності та енергозбереження 
986;Проведення державної експертизи з енергозбереження з видачею експертного висновку та передпроектної документації енерготехнологічної частини техніко-економічних обґрунтувань і проектів будівництва нових та розширення (реконструкції, технічного переобладнання, модернізації) діючих об’єктів та підприємств з річним споживанням паливно-енергетичних ресурсів 1 тис. і більше тонн у перерахунку на умовне паливо – за рішенням замовника в разі надання преференцій (субсидій, податкових або фінансово-кредитних пільг) за рахунок бюджетних коштів;100;5;;;;0;Державне агентство з енергоефективності та енергозбереження 
987;Продовження дії ліцензії на постачання електричної енергії за нерегульованим тарифом;100;5;;;;0;Національна комісія, що здійснює державне регулювання у сфері енергетики та комунальних послуг
988;Продовження строку дії ліцензії на виробництво електричної енергії;100;5;;;;0;Національна комісія, що здійснює державне регулювання у сфері енергетики та комунальних послуг
989;Продовження строку дії ліцензії на комбіноване виробництво теплової та електричної енергії;100;5;;;;0;Національна комісія, що здійснює державне регулювання у сфері енергетики та комунальних послуг
990;Продовження строку дії ліцензії на оптове постачання електричної енергії;100;5;;;;0;Національна комісія, що здійснює державне регулювання у сфері енергетики та комунальних послуг
991;Продовження строку дії ліцензії на передачу електричної енергії магістральними та міждержавними електричними мережами;100;5;;;;0;Національна комісія, що здійснює державне регулювання у сфері енергетики та комунальних послуг
992;Продовження строку дії ліцензії на постачання електричної енергії за регульованим тарифом;100;5;;;;0;Національна комісія, що здійснює державне регулювання у сфері енергетики та комунальних послуг
993;Продовження строкуу дії ліцензії на розподіл електричної енергії (передачу електричної енергії місцевими (локальними) електричними мережами);100;5;;;;0;Національна комісія, що здійснює державне регулювання у сфері енергетики та комунальних послуг
994;_;100;23;;;;0;Тестова служба
995;Анулювання ліцензії на провадження господарської діяльності з посередництва у працевлаштуванні за кордоном за заявою ліцензіата;100;5;;;;0;Управління праці та соціального захисту населення
996;Видача громадянам, іноземцям та особам без громадянства документів про запрошення в Україну;100;4;;;;0;Державна міграційна служба
997;_Видача громадянам, іноземцям та особам без громадянства документів про запрошення в Україну (протягом 10 робочих днів);100;4;;;;0;Державна міграційна служба
998;Видача довідки про звернення за захистом в Україні;100;4;;;;0;Державна міграційна служба
999;Видача довідки про особу, яка добровільно повертається;100;4;;;;0;Державна міграційна служба
1000;Подання адміністративних даних на основі специфікації XML;100;5;;;;0;Національна комісія з цінних паперів та фондового ринку
1001;Видача дозволу на застосування праці іноземців та осіб без громадянства на території ;100;5;;;;0;Управління праці та соціального захисту населення
1002;Видача дозволу на імміграцію в Україну іноземцям або особам без громадянства;100;4;;;;0;Державна міграційна служба
1003;_можно занимать;100;23;;;;0;Тестова служба
1004;_можно занимать;100;23;;;;0;Тестова служба
1005;_можно занимать;100;23;;;;0;Тестова служба
1006;_можно занимать;100;23;;;;0;Тестова служба
1007;_можно занимать;100;23;;;;0;Тестова служба
1008;_можно занимать;100;23;;;;0;Тестова служба
1009;_можно занимать;100;23;;;;0;Тестова служба
1010;_можно занимать;100;23;;;;0;Тестова служба
1011;_можно занимать;100;23;;;;0;Тестова служба
1012;_можно занимать;100;23;;;;0;Тестова служба
1013;_можно занимать;100;23;;;;0;Тестова служба
1014;_можно занимать;100;23;;;;0;Тестова служба
1015;_можно занимать;100;23;;;;0;Тестова служба
1016;_можно занимать;100;23;;;;0;Тестова служба
